PTPZE9LJ,The Pit BBQ,Food and Drink,Restaurants,Barbecue restaurant,Barbecue restaurant,"108 Riverside Ave, Riverside, WY 82325",108 Riverside Ave,Riverside,Wyoming,,,82325,US,True,41.217026399999995,-106.7786893,America/Denver,(307) 32*-****,2,OPERATIONAL,TRUE,TRUE,,True,Riverside,Wyoming,US,https,https://thepitwyo.com,thepitwyo.com,thepitwyo.com,com,243,2025-08-14,2026-08-14,"GoDaddy.com, LLC",,,0,0,0,,TRUE,FALSE,5,0,"{""1"": 0, ""2"": 0, ""3"": 0, ""4"": 0, ""5"": 19}","Curbside pickup, Drive-through, Takeout, Dine-in",,"Dinner, Solo dining",Wheelchair accessible parking lot,Comfort food,Dinner,Restroom,Casual,Tourists,,"Credit cards, Debit cards",Good for kids,FALSE,TRUE,purchase_dataset@,FALSE,TRUE,0,,,,,,,,,,,,,,,,,,,,,,,,,,,,,,,,,,,,,,,,,,,https://thepitwyo.com/menu,,,2026-04-11T05:17:58.215507+00:00,,,,,,,,0.0,0.0,50.0,1.0,1.0,1.0,1.0,1.0,,,,100.0,100.0,100.0,0.0,0.0,100.0,0.0,0.0,100.0,0.0,0.0,100.0,0.0,0.0,stable,stable,0.0,0.0,0.0,0.0,5,11,14,14,57.1,214.3,36.4,26.3,19.5,0,50,50.0,68.0,2,3,3,1498,4321,4321,715738,1498825,1498825,772269,2,,,,,,,,,,1349,2,4,1549,4223,735647,1464979,735647,,,,,,,,,,,,,,,,,,,,,,,,,,,,,,,,,,,,,,,,,,,,,,,,,,,,,,,,,,,,,,,,,,,,,,,,,,,,,,,,,,,,,,,,,,,,,,,,,,,,,,,,,,,,,,,,,,,,,,,,,,,,,,,,,,,,,,,,,,,,,,,,,,,,,,,,,,,,,,,,,,,,,,,,,,,,,,,,,,,,,,,,,,,,,,,,,,,,,,,2,47.7,4.59,201,70.4,0.3981,-21.4,,-201,-0.3981,0.0,1.0,0.0,0.0,0.0,2,46.64,-46.64,0.0,2,,,,,,,,,,,,,,,,,,,,,0.0,,0,0.0,0.0,,,,,,,,,,,,,,,,,,,,,,,,,,,,,,,,,,,,,,,,,,,,,,,,,,,,,,,,,,,,,,,,
VVXF52YN,Wind River Pizza & Pasta,Food and Drink,Restaurants,Pizza restaurant,"Pizza restaurant, Delivery Restaurant, Takeout Restaurant, Pizza delivery, Pizza Takeout","4 Country Club Ln, Pinedale, WY 82941",4 Country Club Ln,Pinedale,Wyoming,,,82941,US,True,42.866188,-109.8778229,America/Denver,(307) 36*-****,1,CLOSED_TEMPORARILY,FALSE,TRUE,,True,Pinedale,Wyoming,US,,,,,,,,,,,,0,0,0,,TRUE,FALSE,4,0,"{""1"": 12, ""2"": 5, ""3"": 9, ""4"": 23, ""5"": 54}",Takeout,,,,"Alcohol, Beer",Dinner,Restroom,,,,,Good for kids,FALSE,FALSE,purchase_dataset@,FALSE,TRUE,0,,,,,,,,,,,,,,,,,,,,,,,,,,,,,,,,,,,,,,,,,,,,,,2026-04-11T04:07:44.367146+00:00,,,,,,,,0.0,0.0,50.0,,,,,,,,,,,,,,,,,,,,,,,,,,,,,,,,,,,,24.5,19.5,0,33,50.0,66.0,14,23,23,1527,4459,4459,727647,1539606,1539606,785178,14,,,,,,,,,,1349,15,26,1549,4223,735647,1464979,735647,,,,,,,,,,,,,,,,,,,,,,,,,,,,,,,,,,,,,,,,,,,,,,,,,,,,,,,,,,,,,,,,,,,,,,,,,,,,,,,,,,,,,,,,,,,,,,,,,,,,,,,,,,,,,,,,,,,,,,,,,,,,,,,,,,,,,,,,,,,,,,,,,,,,,,,,,,,,,,,,,,,,,,,,,,,,,,,,,,,,,,,,,,,,,,,,,,,,,,,13,45.8,4.24,135,66.0,0.2795,-21.3,,-135,-0.2795,0.0833,0.5833,0.0,0.0,0.0,12,37.6,-37.6,0.0,13,,,,,,,,,,,,,,,,,,,,,0.0,,0,0.0,0.0,,,,,,,,,,,,,,,,,,,,,,,,,,,,,,,,,,,,,,,,,,,,,,,,,,,,,,,,,,,,,,,,
ZD3YFBQ7,Dave's Last Stand,Food and Drink,Restaurants,Restaurant,"Restaurant, American restaurant","310 E Pine St, Pinedale, WY 82941",310 E Pine St,Pinedale,Wyoming,,,82941,US,True,42.866181,-109.85681509999999,America/Denver,(307) 36*-****,1,CLOSED_TEMPORARILY,FALSE,TRUE,,True,Pinedale,Wyoming,US,https,https://daveslaststand.com,daveslaststand.com,daveslaststand.com,com,2197,2020-04-08,2027-04-08,"GoDaddy.com, LLC",,,0,0,0,,TRUE,FALSE,4.2,0,"{""1"": 24, ""2"": 13, ""3"": 27, ""4"": 62, ""5"": 184}","Outdoor seating, Takeout, Dine-in",,,Wheelchair accessible entrance,"Comfort food, Small plates, Vegetarian options","Lunch, Dinner, Dessert, Seating",Wi-Fi,,"Family-friendly, LGBTQ+ friendly, Transgender safespace",,,"Good for kids, Kids' menu",FALSE,TRUE,purchase_dataset@,FALSE,TRUE,0,,,,,,,,,,,,,,,,,,,,,,,,,,,,,,,,,,,,,,,,,,,https://daveslaststand.com/#menu,,,2026-04-11T03:48:49.663263+00:00,0.0,,2.8,2678.3,1950.6,25.2101,0.59,0.0,0.0,50.0,0.5029,,,-1.0,-0.1691,0.0833,0.591,,,41.5,,,,,,,0.0,100.0,0.0,39.39,57.58,3.03,stable,stable,,,,,0,0,1,33,-100.0,-100.0,,26.2,19.5,0,50,50.0,66.0,15,26,26,1547,4557,4557,734358,1562866,1562866,792458,15,735880,7,725254,728961,3,751848,,,,1349,15,26,1549,4223,735647,1464979,735647,,,,,,0.0211,0.0,-0.0187,0.0,0.0187,0.1529,0.0,0.0439,0.0,-0.0439,,6,2,735880,731407,725254,0.0151,0.021,0.0292,0.0773,0.0833,46.3,2.73,69,66.7,0.3174,-20.1,,-69,-16.7,-0.3174,728961,405731,751848,0.0385,0.4493,0.009,0.4564,0.591,57.5,4.19,62,79.7,0.5893,-31.3,,-62,-29.7,-0.5893,,,,,Emerging,,,,,Emerging,,,,,,,,,,,,7,3,,560,410,concentrated,0.0,1.91,33.3,50.0,16.7,0.0,1978,1712,concentrated,0.0,0.03,0.0,50.0,50.0,0.0,,,,,,,,,,0.0,-0.0031,0.0,0.0031,8,9,10,1,6,0.1,0.9,0.4,0.1,0.1,49.1,3.1,67,69.9,0.3854,-22.9,,-67,-19.9,-0.3854,moderate,0.0,1.43,25.0,50.0,25.0,0.0,0.43,0.59,19.59,0.0206,0.2927,-0.0206,-0.2927,100,101,1565,1,318,0.1042,0.9118,0.807,0.1718,0.2457,63.7,4.23,307,80.2,0.4347,-37.5,,-307,-30.2,-0.4347,competitive,0.0,0.0004,1.08,1.1,0.5573,0.08,0.3009,-0.08,-0.3009,793989,61.4,3.79,385,76.0,0.4601,-35.2,,-385,-0.4601,0.0525,0.9063,0.0,0.048,0.0391,750393,0.2929,-26.0,1,719601,25.1,59.3,4.4,11.2,793990,13,45.8,4.24,135,66.0,0.2795,-19.6,,-135,-0.2795,0.1667,0.5833,0.0,0.0,0.0,9,37.6,-37.6,0.0,13,39.9,251,357,0.2678,2678.3,1.73,5769,2,0.0533,532.77,0.0,1428.57,0.0,3333.33,,,0.0,1111.11,0.0,99.01,0.0,,0,0.0,0.0,,,,,,0.02,735880,0.015,0.02,735880,0.015,0.15,728961,0.039,0.15,728961,0.039,0.0,0,0.0,0.0,0,0.0,0.43,10,0.1,0.43,10,0.1,0.56,1565,0.104,0.56,1565,0.104,,,,,,,,,,,,,,,,,,,,,,,,,,,,,
DNAM68XE,Los Cabos | Mexican Restaurant,Food and Drink,Restaurants,Mexican restaurant,"Mexican restaurant, Latin American restaurant","120 W Pine St, Pinedale, WY 82941",120 W Pine St,Pinedale,Wyoming,,,82941,US,True,42.8664646,-109.8630147,America/Denver,(307) 36*-****,1,OPERATIONAL,TRUE,TRUE,,True,Pinedale,Wyoming,US,http,http://loscabospinedale.com,loscabospinedale.com,loscabospinedale.com,com,4345,2014-05-22,2026-05-22,"GoDaddy.com, LLC",,,0,0,0,,TRUE,FALSE,4.3,0,"{""1"": 43, ""2"": 27, ""3"": 64, ""4"": 122, ""5"": 462}","Takeout, Dine-in","Fast service, Great beer selection, Great cocktails, Serves local specialty","Lunch, Dinner, Solo dining","Wheelchair accessible entrance, Wheelchair accessible parking lot, Wheelchair accessible restroom, Wheelchair accessible seating","Alcohol, Beer, Cocktails, Coffee, Comfort food, Happy hour drinks, Hard liquor, Quick bite, Small plates, Vegetarian options, Wine","Lunch, Dinner, Catering, Dessert, Seating, Table service","Bar onsite, Restroom","Casual, Cozy","Groups, Tourists",Accepts reservations,"Credit cards, Debit cards, NFC mobile payments","Good for kids, High chairs, Kids' menu",TRUE,TRUE,purchase_dataset@,FALSE,TRUE,0,,,,,,,,,,,,,,,,,,,,,,,,,,,,,,,,,,,,,,,,,,,https://loscabospinedale.com,,,2026-04-11T03:48:49.577417+00:00,,,,,,,,0.0,0.0,50.0,0.6166,0.2129,0.498,0.4362,0.4635,,,,74.9,73.2,50.0,50.0,0.0,60.0,20.0,20.0,62.5,25.0,12.5,70.97,25.81,3.23,declining,stable,-0.2851,1.7,0.0345,2.3,2,5,8,31,25.0,-35.5,20.0,26.2,19.5,0,50,50.0,66.0,10,17,17,1434,4045,4045,693044,1430227,1430227,747819,10,,,,,,,,,,1349,15,26,1549,4223,735647,1464979,735647,,,,,,,,,,,,,,,,,,,,,,,,,,,,,,,,,,,,,,,,,,,,,,,,,,,,,,,,,,,,,,,,,,,,,,,,,,,,,,,,,,,,,,,,,,,,,,,,,,,,,,,,,,,,,,,,,,,,,,,,,,,,,,,,,,,,,,,,,,,,,,,,,,,,,,,,,,,,,,,,,,,,,,,,,,,,,,,,,,,,,,,,,,,,,,,,,,,,,,,13,45.8,4.24,135,66.0,0.2795,-19.6,,-135,-0.2795,0.1667,0.5833,0.0,0.0,0.0,9,37.6,-37.6,0.0,13,,,,,,,,,,,,,,,,,,,,,0.0,,0,0.0,0.0,,,,,,,,,,,,,,,,,,,,,,,,,,,,,,,,,,,,,,,,,,,,,,,,,,,,,,,,,,,,,,,,
QPPSMYEB,Patio Grill | Authentic Mexican Restaurant,Food and Drink,Restaurants,Mexican restaurant,Mexican restaurant,"35 W Pine St, Pinedale, WY 82941",35 W Pine St,Pinedale,Wyoming,,,82941,US,True,42.866839,-109.86202999999999,America/Denver,(307) 36*-****,1,OPERATIONAL,TRUE,TRUE,,True,Pinedale,Wyoming,US,https,https://facebook.com/thepatiogrill,facebook.com/thepatiogrill,facebook.com,com,10608,1997-03-29,2034-03-30,"RegistrarSafe, LLC",,,0,0,0,,TRUE,FALSE,4.2,0,"{""1"": 18, ""2"": 14, ""3"": 24, ""4"": 58, ""5"": 146}","Outdoor seating, Takeout, Dine-in","Fast service, Serves local specialty","Breakfast, Lunch, Dinner, Solo dining","Wheelchair accessible entrance, Wheelchair accessible parking lot, Wheelchair accessible restroom, Wheelchair accessible seating","Alcohol, Beer, Cocktails, Coffee, Comfort food, Happy hour food, Hard liquor, Quick bite, Small plates","Breakfast, Lunch, Dinner, Dessert, Seating, Table service","Bar onsite, Restroom, Wi-Fi","Casual, Cozy, Quiet","Family-friendly, Groups, Tourists",,"Checks, Credit cards, Debit cards, NFC mobile payments","Good for kids, High chairs, Kids' menu",TRUE,TRUE,purchase_dataset@,TRUE,TRUE,1,,,,,,,,,,,,https://www.facebook.com/thepatiogrill,thepatiogrill,,,,,,,,,,,,,,,,,,,,,,,,,,,,,,,,,2026-04-11T03:48:34.043549+00:00,,,,,,,,0.0,0.0,50.0,0.5732,,,-0.2996,0.3406,,,,,67.0,,,,,,,33.33,66.67,0.0,66.67,28.57,4.76,stable,stable,,,,,0,0,3,21,-100.0,-100.0,,28.7,19.5,8,67,50.0,66.0,12,21,21,1500,4333,4333,717414,1504625,1504625,774088,12,,,,,,,,,,1349,15,26,1549,4223,735647,1464979,735647,,,,,,,,,,,,,,,,,,,,,,,,,,,,,,,,,,,,,,,,,,,,,,,,,,,,,,,,,,,,,,,,,,,,,,,,,,,,,,,,,,,,,,,,,,,,,,,,,,,,,,,,,,,,,,,,,,,,,,,,,,,,,,,,,,,,,,,,,,,,,,,,,,,,,,,,,,,,,,,,,,,,,,,,,,,,,,,,,,,,,,,,,,,,,,,,,,,,,,,13,45.8,4.24,135,66.0,0.2795,-17.1,,-135,-0.2795,0.4167,0.5833,0.0,0.0,0.0,8,37.6,-37.6,0.0,13,,,,,,,,,,,,,,,,,,,,,0.0,,0,0.0,0.0,,,,,,,,,,,,,,,,,,,,,,,,,,,,,,,,,,,,,,,,,,,,,,,,,,,,,,,,,,,,,,,,
Z7AKXPJN,Lakeside Restaurant,Food and Drink,Restaurants,Restaurant,Restaurant,"99 Forest service Rd #111, Pinedale, WY 82941",99 Forest service Rd #111,Pinedale,Wyoming,,,82941,US,False,42.899175299999996,-109.8252266,America/Denver,(307) 36*-****,2,CLOSED_TEMPORARILY,FALSE,TRUE,,False,Pinedale,Wyoming,US,http,http://lakesidelodge.com,lakesidelodge.com,lakesidelodge.com,com,10304,1998-01-27,2027-01-26,"GoDaddy.com, LLC",,,0,0,0,,TRUE,FALSE,4.2,0,"{""1"": 7, ""2"": 2, ""3"": 13, ""4"": 15, ""5"": 54}","Outdoor seating, Takeout, Dine-in",,,Wheelchair accessible entrance,"Alcohol, Beer, Cocktails, Happy hour drinks, Hard liquor, Vegetarian options, Wine","Brunch, Lunch, Dinner, Catering, Dessert","Bar onsite, Restroom, Wi-Fi",,Family-friendly,Accepts reservations,,"Good for kids, Has changing table(s), High chairs, Kids' menu",FALSE,TRUE,purchase_dataset@,FALSE,TRUE,0,,,,,,,,,,,,,,,,,,,,,,,,,,,,,,,,,,,,,,,,,,,,,,2026-04-11T03:48:34.039345+00:00,,,,,,,,0.0,0.0,50.0,0.5101,,,,0.4496,,,,,72.5,,,,,,,,,,72.73,27.27,0.0,stable,stable,,,,,0,0,0,11,,-100.0,,26.2,19.5,0,50,50.0,66.0,68818,136139,136139,1545,4550,4550,733976,1561620,1561620,792045,68818,,,,,,,,,,1349,10918,41212,1549,4223,735647,1464979,735647,,,,,,,,,,,,,,,,,,,,,,,,,,,,,,,,,,,,,,,,,,,,,,,,,,,,,,,,,,,,,,,,,,,,,,,,,,,,,,,,,,,,,,,,,,,,,,,,,,,,,,,,,,,,,,,,,,,,,,,,,,,,,,,,,,,,,,,,,,,,,,,,,,,,,,,,,,,,,,,,,,,,,,,,,,,,,,,,,,,,,,,,,,,,,,,,,,,,,,,,,,,,,,,,,,,,,,,,,,,,,,,,,,,,,,,,,,,,,,,0.0,,0,0.0,0.0,,,,,,,,,,,,,,,,,,,,,,,,,,,,,,,,,,,,,,,,,,,,,,,,,,,,,,,,,,,,,,,,
BETHB966,Crazy Tony's,Food and Drink,Restaurants,Restaurant,"Restaurant, Bar, Caterer","300 W Whalen St, Guernsey, WY 82214",300 W Whalen St,Guernsey,Wyoming,,,82214,US,True,42.2693971,-104.74604049999999,America/Denver,(307) 83*-****,1,OPERATIONAL,TRUE,TRUE,,True,Guernsey,Wyoming,US,,,,,,,,,,,,0,0,0,,TRUE,FALSE,4.1,0,"{""1"": 20, ""2"": 12, ""3"": 30, ""4"": 76, ""5"": 147}","Outdoor seating, Drive-through, Onsite services, Takeout, Dine-in","Fast service, Great beer selection, Great cocktails, Sports","Lunch, Dinner, Solo dining",Wheelchair accessible seating,"Alcohol, Beer, Cocktails, Coffee, Comfort food, Happy hour drinks, Happy hour food, Hard liquor, Late-night food, Quick bite, Small plates, Wine","Lunch, Dinner, Catering, Dessert, Seating, Table service","Bar onsite, Restroom","Casual, Cozy","Groups, Tourists",,"Checks, Credit cards, Debit cards, NFC mobile payments",Kids' menu,TRUE,FALSE,purchase_dataset@,FALSE,TRUE,0,,,,,,,,,,,,,,,,,,,,,,,,,,,,,,,,,,,,,,,,,,,,,,2026-04-11T03:45:06.672023+00:00,,,,,,,,0.0,0.0,50.0,0.5399,0.3333,0.3623,0.3623,0.4411,,,,68.1,72.1,66.67,33.33,0.0,66.67,33.33,0.0,66.67,33.33,0.0,71.43,28.57,0.0,stable,declining,-0.029,-4.0,-0.0788,-5.5,3,6,6,21,100.0,14.3,50.0,24.5,19.5,0,33,50.0,66.0,2,3,3,1420,3970,3970,687924,1415108,1415108,742312,2,,,,,,,,,,1349,3,9,1549,4223,735647,1464979,735647,,,,,,,,,,,,,,,,,,,,,,,,,,,,,,,,,,,,,,,,,,,,,,,,,,,,,,,,,,,,,,,,,,,,,,,,,,,,,,,,,,,,,,,,,,,,,,,,,,,,,,,,,,,,,,,,,,,,,,,,,,,,,,,,,,,,,,,,,,,,,,,,,,,,,,,,,,,,,,,,,,,,,,,,,,,,,,,,,,,,,,,,,,,,,,,,,,,,,,,3,40.7,4.25,85,60.5,0.2102,-16.2,,-85,-0.2102,0.0,0.5,0.0,0.0,0.0,3,27.03,-27.03,0.0,3,,,,,,,,,,,,,,,,,,,,,0.0,,0,0.0,0.0,,,,,,,,,,,,,,,,,,,,,,,,,,,,,,,,,,,,,,,,,,,,,,,,,,,,,,,,,,,,,,,,
7E4G3ZC9,Fathom Restaurant,Food and Drink,Restaurants,Restaurant,"Restaurant, American restaurant, Grill, Asian restaurant, Breakfast restaurant, Hamburger restaurant, Indian restaurant","461 S Washington St, Afton, WY 83110",461 S Washington St,Afton,Wyoming,,,83110,US,True,42.7241143,-110.9333051,America/Denver,(307) 88*-****,1,CLOSED_TEMPORARILY,FALSE,TRUE,,True,Afton,Wyoming,US,,,,,,,,,,,,0,0,0,,TRUE,FALSE,4.6,0,"{""1"": 8, ""2"": 3, ""3"": 9, ""4"": 19, ""5"": 137}","Takeout, Dine-in",,,"Wheelchair accessible entrance, Wheelchair accessible parking lot, Wheelchair accessible restroom, Wheelchair accessible seating","Alcohol, Beer, Coffee, Comfort food, Salad bar, Small plates, Wine","Breakfast, Brunch, Lunch, Dinner, Dessert, Seating","Restroom, Wi-Fi",,Family-friendly,Accepts reservations,"Checks, Debit cards, NFC mobile payments","Good for kids, High chairs, Kids' menu",FALSE,FALSE,purchase_dataset@,FALSE,TRUE,0,,,,,,,,,,,,,,,,,,,,,,,,,,,,,,,,,,,,,,,,,,,,,,2026-04-11T03:41:52.891805+00:00,,,,,,,,0.0,0.0,50.0,0.7573,,,,1.0,,,,,100.0,,,,,,,,,,100.0,0.0,0.0,stable,stable,,,,,0,0,0,2,,-100.0,,24.5,19.5,0,33,50.0,66.0,11,22,22,1397,3880,3880,678880,1388100,1388100,732574,11,,,,,,,,,,1349,15,38,1549,4223,735647,1464979,735647,,,,,,,,,,,,,,,,,,,,,,,,,,,,,,,,,,,,,,,,,,,,,,,,,,,,,,,,,,,,,,,,,,,,,,,,,,,,,,,,,,,,,,,,,,,,,,,,,,,,,,,,,,,,,,,,,,,,,,,,,,,,,,,,,,,,,,,,,,,,,,,,,,,,,,,,,,,,,,,,,,,,,,,,,,,,,,,,,,,,,,,,,,,,,,,,,,,,,,,12,52.2,4.33,157,71.1,0.357,-27.7,,-157,-0.357,0.0,0.7273,0.0,0.0,0.0,12,49.69,-49.69,0.0,12,,,,,,,,,,,,,,,,,,,,,0.0,,0,0.0,0.0,,,,,,,,,,,,,,,,,,,,,,,,,,,,,,,,,,,,,,,,,,,,,,,,,,,,,,,,,,,,,,,,
MV2E6FDQ,The Reservoir Bar & Grill,Food and Drink,Restaurants,Bar & grill,"Bar & grill, Bar, Restaurant","6 Hays Blvd, Pine Haven, WY 82721",6 Hays Blvd,Pine Haven,Wyoming,,,82721,US,True,44.358346499999996,-104.81071879999999,America/Denver,,1,CLOSED_TEMPORARILY,TRUE,TRUE,,True,Pine Haven,Wyoming,US,https,https://facebook.com/thereservoirbar,facebook.com/thereservoirbar,facebook.com,com,10608,1997-03-29,2034-03-30,"RegistrarSafe, LLC",,,0,0,0,,TRUE,FALSE,4.6,0,"{""1"": 2, ""2"": 2, ""3"": 5, ""4"": 15, ""5"": 78}","Outdoor seating, Takeout, Dine-in","Bar games, Fast service, Great beer selection, Great cocktails, Live performances, Sports","Lunch, Dinner, Solo dining","Wheelchair accessible entrance, Wheelchair accessible parking lot, Wheelchair accessible restroom, Wheelchair accessible seating","Alcohol, Beer, Cocktails, Coffee, Comfort food, Food, Food at bar, Hard liquor, Late-night food, Quick bite, Small plates, Wine","Lunch, Dinner, Catering, Dessert, Seating, Table service","Bar onsite, Restroom, Wi-Fi",Casual,"Groups, Tourists",Accepts reservations,"Credit cards, Debit cards, NFC mobile payments",High chairs,TRUE,TRUE,purchase_dataset@,TRUE,FALSE,1,,,,,,,,,,,,https://www.facebook.com/thereservoirbar/,thereservoirbar,,,,,,,,,,,,,,,,,,,,,,,,,,,,,,,,,2026-04-11T02:21:02.114857+00:00,,,,,,,,0.0,0.0,50.0,0.7931,1.0,1.0,1.0,0.3333,,,,100.0,66.7,100.0,0.0,0.0,100.0,0.0,0.0,100.0,0.0,0.0,66.67,33.33,0.0,stable,improving,0.0,33.3,0.6667,49.9,1,1,1,3,100.0,33.3,200.0,26.9,19.5,8,50,50.0,64.0,2,2,2,1483,4265,4265,711434,1485683,1485683,767625,2,,,,,,,,,,1349,2,2,1549,4223,735647,1464979,735647,,,,,,,,,,,,,,,,,,,,,,,,,,,,,,,,,,,,,,,,,,,,,,,,,,,,,,,,,,,,,,,,,,,,,,,,,,,,,,,,,,,,,,,,,,,,,,,,,,,,,,,,,,,,,,,,,,,,,,,,,,,,,,,,,,,,,,,,,,,,,,,,,,,,,,,,,,,,,,,,,,,,,,,,,,,,,,,,,,,,,,,,,,,,,,,,,,,,,,,2,26.5,,0,50.0,0.0,0.4,,0,0.0,1.0,0.0,0.0,0.0,0.0,1,0.0,0.0,0.0,2,,,,,,,,,,,,,,,,,,,,,0.0,,0,0.0,0.0,,,,,,,,,,,,,,,,,,,,,,,,,,,,,,,,,,,,,,,,,,,,,,,,,,,,,,,,,,,,,,,,
