beam_id,title,category_main_group,category_sub_group,category,categories,address,street,city,state,borough,neighborhood,postal_code,country,address_verified,latitude,longitude,timezone,phone,price_level,business_status,has_open_hours,has_price,census_place,verified_census_city,beam_location_name,beam_state_code,beam_country_code,website_protocol,website,website_normalized,website_domain,website_domain_tld,website_domain_age,website_domain_registered,website_domain_expires,website_domain_registrar,emails_list,emails_list_website_domain,emails_count,emails_deliverable_count,emails_risky_count,description,has_about,has_description,rating,reviews_total_count,reviews_per_rating,service_options,highlights,popular_for,accessibility,offerings,dining_options,amenities,atmosphere,crowd,planning,payments,children,has_popular_times,has_website,has_email,has_social,has_phone,socials_count,first_social_post_date,last_social_post_date,first_social_post_days,last_social_post_days,social_post_count,first_social_post_days_min,first_social_post_days_max,last_social_post_days_min,last_social_post_days_max,social_profile_instagram,social_username_instagram,social_profile_facebook,social_username_facebook,social_profile_twitter,social_username_twitter,social_profile_tiktok,social_username_tiktok,social_profile_linkedin,social_username_linkedin,social_profile_youtube,social_username_youtube,social_profile_github,social_username_github,social_profile_snapchat,social_username_snapchat,social_profile_pinterest,social_username_pinterest,instagram_followers,instagram_engagement_rate,instagram_engagement_rate_1m,instagram_engagement_rate_3m,instagram_engagement_rate_6m,instagram_engagement_rate_12m,instagram_post_count,tiktok_followers,tiktok_video_count,tiktok_heart_count,tiktok_engagement_rate,tiktok_engagement_rate_1m,tiktok_engagement_rate_3m,tiktok_engagement_rate_6m,tiktok_engagement_rate_12m,menu_link,order_links,reservation_link,last_updated_at,beam_cross_social_market_penetration,beam_cross_velocity_quality,beam_cross_social_urgency,beam_cross_per_capita_engagement,beam_cross_market_saturation_lead,beam_cross_population_adjusted_rank,beam_cross_demand_gap_index,beam_rating_score,beam_review_confidence,beam_rating_health,sentiment_avg,sentiment_avg_30d,sentiment_avg_90d,sentiment_avg_180d,sentiment_avg_360d,sentiment_percentile_1km,sentiment_percentile_5km,sentiment_percentile_10km,sentiment_score_90d,sentiment_score_360d,sentiment_positive_pct_30d,sentiment_negative_pct_30d,sentiment_neutral_pct_30d,sentiment_positive_pct_90d,sentiment_negative_pct_90d,sentiment_neutral_pct_90d,sentiment_positive_pct_180d,sentiment_negative_pct_180d,sentiment_neutral_pct_180d,sentiment_positive_pct_360d,sentiment_negative_pct_360d,sentiment_neutral_pct_360d,sentiment_trend_30vs90d,sentiment_trend_90vs360d,sentiment_diff_30vs90d,sentiment_change_360d,sentiment_diff_90vs360d,sentiment_change_pct_360d,reviews_count_30d,reviews_count_90d,reviews_count_180d,reviews_count_360d,review_growth_pct_180d,review_growth_pct_360d,review_growth_pct_90d,beam_score_overall,beam_popularity_percentile,beam_social_presence,beam_data_completeness,beam_price_value,beam_data_freshness,beam_rank_city_category,beam_rank_city_overall,beam_rank_city_reviews,beam_rank_state_category,beam_rank_state_overall,beam_rank_state_reviews,beam_rank_country_category,beam_rank_country_overall,beam_rank_country_reviews,beam_rank_place_global_category,beam_rank_category,beam_rank_competition_1km_category,beam_rank_competition_1km_total,beam_rank_competition_1km_reviews,beam_rank_competition_5km_category,beam_rank_competition_5km_total,beam_rank_competition_5km_reviews,beam_rank_competition_10km_category,beam_rank_competition_10km_total,beam_rank_competition_10km_reviews,beam_export_rank,total_city_category,total_city,total_state_category,total_state,total_country_category,total_country,total_category_global,beam_competitors_10km_competitive_strength,beam_competitors_10km_competitor_avg_sentiment_30d,beam_competitors_10km_competitor_avg_sentiment_90d,beam_competitors_10km_sentiment_diff_30d,beam_competitors_10km_sentiment_diff_90d,beam_competitors_1km_competitive_strength,beam_competitors_1km_competitor_avg_sentiment_30d,beam_competitors_1km_competitor_avg_sentiment_90d,beam_competitors_1km_sentiment_diff_30d,beam_competitors_1km_sentiment_diff_90d,beam_competitors_5km_competitive_strength,beam_competitors_5km_competitor_avg_sentiment_30d,beam_competitors_5km_competitor_avg_sentiment_90d,beam_competitors_5km_sentiment_diff_30d,beam_competitors_5km_sentiment_diff_90d,beam_competitors_10km_competitor_count,beam_competitors_1km_competitor_count,beam_competitors_5km_competitor_count,beam_competitors_1km_rank_by_score,beam_competitors_1km_rank_by_rating,beam_competitors_1km_rank_by_reviews,beam_competitors_1km_score_percentile,beam_competitors_1km_rating_percentile,beam_competitors_1km_reviews_percentile,beam_competitors_1km_health_percentile,beam_competitors_1km_sentiment_percentile,beam_competitors_1km_competitor_avg_score,beam_competitors_1km_competitor_avg_rating,beam_competitors_1km_competitor_avg_reviews,beam_competitors_1km_competitor_avg_health,beam_competitors_1km_competitor_avg_sentiment,beam_competitors_1km_score_diff,beam_competitors_1km_rating_diff,beam_competitors_1km_reviews_diff,beam_competitors_1km_health_diff,beam_competitors_1km_sentiment_diff,beam_competitors_5km_rank_by_score,beam_competitors_5km_rank_by_rating,beam_competitors_5km_rank_by_reviews,beam_competitors_5km_score_percentile,beam_competitors_5km_rating_percentile,beam_competitors_5km_reviews_percentile,beam_competitors_5km_health_percentile,beam_competitors_5km_sentiment_percentile,beam_competitors_5km_competitor_avg_score,beam_competitors_5km_competitor_avg_rating,beam_competitors_5km_competitor_avg_reviews,beam_competitors_5km_competitor_avg_health,beam_competitors_5km_competitor_avg_sentiment,beam_competitors_5km_score_diff,beam_competitors_5km_rating_diff,beam_competitors_5km_reviews_diff,beam_competitors_5km_health_diff,beam_competitors_5km_sentiment_diff,beam_competitors_10km_rank_by_score,beam_competitors_10km_rank_by_rating,beam_competitors_10km_rank_by_reviews,beam_competitors_10km_score_percentile,beam_competitors_1km_competitive_tier,beam_competitors_10km_rating_percentile,beam_competitors_10km_reviews_percentile,beam_competitors_10km_health_percentile,beam_competitors_10km_sentiment_percentile,beam_competitors_5km_competitive_tier,beam_competitors_10km_competitor_avg_score,beam_competitors_10km_competitor_avg_rating,beam_competitors_10km_competitor_avg_reviews,beam_competitors_10km_competitor_avg_health,beam_competitors_10km_competitive_tier,beam_competitors_10km_competitor_avg_sentiment,beam_competitors_10km_score_diff,beam_competitors_10km_rating_diff,beam_competitors_10km_reviews_diff,beam_competitors_10km_health_diff,beam_competitors_10km_sentiment_diff,beam_competitors_1km_total_in_radius,beam_competitors_5km_total_in_radius,beam_competitors_10km_total_in_radius,beam_competitors_1km_avg_distance_m,beam_competitors_1km_closest_competitor_m,beam_competitors_1km_market_type,beam_competitors_1km_review_share,beam_competitors_1km_density_per_sqkm,beam_competitors_1km_tier_below_40,beam_competitors_1km_tier_40_59,beam_competitors_1km_tier_60_79,beam_competitors_1km_tier_80_100,beam_competitors_5km_avg_distance_m,beam_competitors_5km_closest_competitor_m,beam_competitors_5km_market_type,beam_competitors_5km_review_share,beam_competitors_5km_density_per_sqkm,beam_competitors_5km_tier_below_40,beam_competitors_5km_tier_40_59,beam_competitors_5km_tier_60_79,beam_competitors_5km_tier_80_100,beam_competitors_10km_avg_distance_m,beam_competitors_10km_closest_competitor_m,beam_competitors_10km_market_type,beam_competitors_10km_review_share,beam_competitors_10km_density_per_sqkm,beam_competitors_10km_tier_below_40,beam_competitors_10km_tier_40_59,beam_competitors_10km_tier_60_79,beam_competitors_10km_tier_80_100,beam_competitors_city_competitor_avg_sentiment_30d,beam_competitors_city_competitor_avg_sentiment_90d,beam_competitors_city_sentiment_diff_30d,beam_competitors_city_sentiment_diff_90d,beam_competitors_city_competitor_count,beam_competitors_city_total_in_city,beam_competitors_city_rank_by_score,beam_competitors_city_rank_by_rating,beam_competitors_city_rank_by_reviews,beam_competitors_city_score_percentile,beam_competitors_city_rating_percentile,beam_competitors_city_reviews_percentile,beam_competitors_city_health_percentile,beam_competitors_city_sentiment_percentile,beam_competitors_city_competitor_avg_score,beam_competitors_city_competitor_avg_rating,beam_competitors_city_competitor_avg_reviews,beam_competitors_city_competitor_avg_health,beam_competitors_city_competitor_avg_sentiment,beam_competitors_city_score_diff,beam_competitors_city_rating_diff,beam_competitors_city_reviews_diff,beam_competitors_city_health_diff,beam_competitors_city_sentiment_diff,beam_competitors_city_market_type,beam_competitors_city_review_share,beam_competitors_city_density_per_sqkm,beam_competitors_city_tier_below_40,beam_competitors_city_tier_40_59,beam_competitors_city_tier_60_79,beam_competitors_city_tier_80_100,beam_competitors_city_competitive_strength,beam_competitors_city_underserved_score,beam_competitors_city_competition_intensity,beam_competitors_state_competitor_avg_sentiment_30d,beam_competitors_state_competitor_avg_sentiment_90d,beam_competitors_state_sentiment_diff_30d,beam_competitors_state_sentiment_diff_90d,beam_competitors_state_competitor_count,beam_competitors_state_total_in_state,beam_competitors_state_rank_by_score,beam_competitors_state_rank_by_rating,beam_competitors_state_rank_by_reviews,beam_competitors_state_score_percentile,beam_competitors_state_rating_percentile,beam_competitors_state_reviews_percentile,beam_competitors_state_health_percentile,beam_competitors_state_sentiment_percentile,beam_competitors_state_competitor_avg_score,beam_competitors_state_competitor_avg_rating,beam_competitors_state_competitor_avg_reviews,beam_competitors_state_competitor_avg_health,beam_competitors_state_competitor_avg_sentiment,beam_competitors_state_score_diff,beam_competitors_state_rating_diff,beam_competitors_state_reviews_diff,beam_competitors_state_health_diff,beam_competitors_state_sentiment_diff,beam_competitors_state_market_type,beam_competitors_state_review_share,beam_competitors_state_density_per_sqkm,beam_competitors_state_underserved_score,beam_competitors_state_competition_intensity,beam_competitors_state_competitive_strength,beam_competitors_country_competitor_avg_sentiment_30d,beam_competitors_country_competitor_avg_sentiment_90d,beam_competitors_country_sentiment_diff_30d,beam_competitors_country_sentiment_diff_90d,beam_competitors_country_competitor_count,beam_competitors_country_competitor_avg_score,beam_competitors_country_competitor_avg_rating,beam_competitors_country_competitor_avg_reviews,beam_competitors_country_competitor_avg_health,beam_competitors_country_competitor_avg_sentiment,beam_competitors_country_score_diff,beam_competitors_country_rating_diff,beam_competitors_country_reviews_diff,beam_competitors_country_sentiment_diff,beam_competitors_country_score_percentile,beam_competitors_country_rating_percentile,beam_competitors_country_reviews_percentile,beam_competitors_country_health_percentile,beam_competitors_country_sentiment_percentile,beam_competitors_country_rank_by_score,beam_competitors_country_competitive_strength,beam_competitors_country_health_diff,beam_competitors_country_rank_by_rating,beam_competitors_country_rank_by_reviews,beam_competitors_country_tier_40_59,beam_competitors_country_tier_60_79,beam_competitors_country_tier_80_100,beam_competitors_country_tier_below_40,beam_competitors_country_total_in_country,beam_competitors_city_siblings_competitor_count,beam_competitors_city_siblings_competitor_avg_score,beam_competitors_city_siblings_competitor_avg_rating,beam_competitors_city_siblings_competitor_avg_reviews,beam_competitors_city_siblings_competitor_avg_health,beam_competitors_city_siblings_competitor_avg_sentiment,beam_competitors_city_siblings_score_diff,beam_competitors_city_siblings_rating_diff,beam_competitors_city_siblings_reviews_diff,beam_competitors_city_siblings_sentiment_diff,beam_competitors_city_siblings_score_percentile,beam_competitors_city_siblings_rating_percentile,beam_competitors_city_siblings_reviews_percentile,beam_competitors_city_siblings_health_percentile,beam_competitors_city_siblings_sentiment_percentile,beam_competitors_city_siblings_rank_by_score,beam_competitors_city_siblings_competitor_avg_recommend_pct,beam_competitors_city_siblings_recommend_pct_diff,beam_competitors_city_siblings_recommend_pct_percentile,beam_competitors_city_siblings_total_siblings,beam_competitors_city_businesses_per_10k_pop,beam_competitors_city_population_per_business,beam_competitors_city_population_density,beam_competitors_city_reviews_per_capita,beam_competitors_city_reviews_per_10k_pop,beam_competitors_state_businesses_per_10k_pop,beam_competitors_state_population_per_business,beam_competitors_state_population_density,beam_competitors_state_reviews_per_capita,beam_competitors_state_reviews_per_10k_pop,beam_competitors_1km_hhi_contribution,beam_competitors_1km_hhi_minimum,beam_competitors_5km_hhi_contribution,beam_competitors_5km_hhi_minimum,beam_competitors_10km_hhi_contribution,beam_competitors_10km_hhi_minimum,beam_competitors_city_hhi_contribution,beam_competitors_city_hhi_minimum,beam_competitors_state_hhi_contribution,beam_competitors_state_hhi_minimum,beam_trends_score_30d_beam_score_overall,beam_trends_score_30d_rating,beam_trends_score_30d_review_count,beam_trends_score_30d_beam_rating_health,beam_trends_score_30d_beam_popularity_percentile,beam_trends_score_90d_beam_score_overall,beam_trends_score_90d_rating,beam_trends_score_90d_review_count,beam_trends_score_90d_beam_rating_health,beam_trends_score_90d_beam_popularity_percentile,beam_trends_competitive_1km_30d_strength_change,beam_trends_competitive_1km_30d_rank_change,beam_trends_competitive_1km_30d_percentile_change,beam_trends_competitive_1km_90d_strength_change,beam_trends_competitive_1km_90d_rank_change,beam_trends_competitive_1km_90d_percentile_change,beam_trends_competitive_5km_30d_strength_change,beam_trends_competitive_5km_30d_rank_change,beam_trends_competitive_5km_30d_percentile_change,beam_trends_competitive_5km_90d_strength_change,beam_trends_competitive_5km_90d_rank_change,beam_trends_competitive_5km_90d_percentile_change,beam_trends_competitive_10km_30d_strength_change,beam_trends_competitive_10km_30d_rank_change,beam_trends_competitive_10km_30d_percentile_change,beam_trends_competitive_10km_90d_strength_change,beam_trends_competitive_10km_90d_rank_change,beam_trends_competitive_10km_90d_percentile_change,beam_trends_competitive_city_30d_strength_change,beam_trends_competitive_city_30d_rank_change,beam_trends_competitive_city_30d_percentile_change,beam_trends_competitive_city_90d_strength_change,beam_trends_competitive_city_90d_rank_change,beam_trends_competitive_city_90d_percentile_change,beam_trends_competitive_state_30d_strength_change,beam_trends_competitive_state_30d_rank_change,beam_trends_competitive_state_30d_percentile_change,beam_trends_competitive_state_90d_strength_change,beam_trends_competitive_state_90d_rank_change,beam_trends_competitive_state_90d_percentile_change,beam_trends_sentiment_current_sentiment,beam_trends_sentiment_positive_ratio,beam_trends_sentiment_negative_ratio,beam_trends_sentiment_review_count,beam_trends_velocity_reviews_per_day,beam_trends_velocity_reviews_per_month,beam_trends_velocity_percentile_city,beam_trends_velocity_percentile_state,beam_trends_velocity_trend,beam_velocity_reviews_per_day,beam_velocity_reviews_per_week,beam_velocity_reviews_per_month,beam_velocity_reviews_last_30d,beam_velocity_reviews_last_90d,beam_velocity_reviews_last_365d,beam_velocity_percentile_1km,beam_velocity_percentile_5km,beam_velocity_percentile_10km,beam_velocity_percentile_city,beam_velocity_percentile_state,beam_velocity_rank_1km,beam_velocity_rank_5km,beam_velocity_rank_10km,beam_velocity_rank_city,beam_velocity_rank_state,beam_velocity_trend,beam_velocity_change_30d,beam_velocity_change_90d,beam_trends_sentiment_recommend_pct
YC6DGPBB,A&W Restaurant,Food and Drink,Restaurants,Fast food restaurant,"Fast food restaurant, American restaurant, Hamburger restaurant","706 Parson St, Pine Bluffs, WY 82082",706 Parson St,Pine Bluffs,Wyoming,,,82082,US,True,41.1771795,-104.0763094,America/Denver,(307) 24*-****,1,CLOSED_PERMANENTLY,FALSE,TRUE,,True,Pine Bluffs,Wyoming,US,https,https://awrestaurants.com,awrestaurants.com,awrestaurants.com,com,10032,1998-10-26,2026-10-25,NAMECHEAP INC,,,0,0,0,,TRUE,FALSE,4.2,0,"{""1"": 39, ""2"": 9, ""3"": 61, ""4"": 105, ""5"": 281}","Curbside pickup, Drive-through, Takeout, Dine-in",,,"Wheelchair accessible entrance, Wheelchair accessible parking lot, Wheelchair accessible restroom","Beer, Coffee","Lunch, Dinner, Dessert",Restroom,,,,,"Good for kids, High chairs, Kids' menu",FALSE,TRUE,purchase_dataset@,FALSE,TRUE,0,,,,,,,,,,,,,,,,,,,,,,,,,,,,,,,,,,,,,,,,,,,,,,2026-04-11T13:15:40.496432+00:00,,,,,,,,0.0,0.0,50.0,,,,,,,,,,,,,,,,,,,,,,,,,,,,,,,,,,,,27.7,19.5,0,50,50.0,96.0,2,7,7,1539,4517,4517,732340,1556049,1556049,790271,2,,,,,,,,,,1349,2,8,1549,4223,735647,1464979,735647,,,,,,,,,,,,,,,,,,,,,,,,,,,,,,,,,,,,,,,,,,,,,,,,,,,,,,,,,,,,,,,,,,,,,,,,,,,,,,,,,,,,,,,,,,,,,,,,,,,,,,,,,,,,,,,,,,,,,,,,,,,,,,,,,,,,,,,,,,,,,,,,,,,,,,,,,,,,,,,,,,,,,,,,,,,,,,,,,,,,,,,,,,,,,,,,,,,,,,,2,45.2,3.67,72,58.0,0.1515,-17.5,,-72,-0.1515,0.0,1.0,0.0,0.0,0.0,2,37.76,-37.76,0.0,2,,,,,,,,,,,,,,,,,,,,,0.0,,0,0.0,0.0,,,,,,,,,,,,,,,,,,,,,,,,,,,,,,,,,,,,,,,,,,,,,,,,,,,,,,,,,,,,,,,,
U9AWPJM8,Taco Time,Food and Drink,Restaurants,Mexican restaurant,Mexican restaurant,"104 N Main St, Lyman, WY 82937",104 N Main St,Lyman,Wyoming,,,82937,US,True,41.327804,-110.2926001,America/Denver,(307) 78*-****,1,CLOSED_PERMANENTLY,FALSE,TRUE,,True,Lyman,Wyoming,US,https,https://tacotime.com/stores/6420,tacotime.com/stores/6420,tacotime.com,com,10562,1997-05-14,2027-05-15,"Network Solutions, LLC",,,0,0,0,"Longtime Mexican fast-food chain serving tacos, crisp burritos & kids' meals in simple surrounds.",TRUE,TRUE,3.7,0,"{""1"": 18, ""2"": 18, ""3"": 30, ""4"": 38, ""5"": 68}","Curbside pickup, Delivery, Drive-through, Takeout, Dine-in",Fast service,"Breakfast, Lunch, Dinner, Solo dining","Wheelchair accessible entrance, Wheelchair accessible parking lot, Wheelchair accessible restroom, Wheelchair accessible seating","Coffee, Comfort food, Quick bite, Small plates, Vegetarian options","Breakfast, Lunch, Dinner, Catering, Counter service, Dessert, Seating","Restroom, Wi-Fi","Casual, Quiet","Family-friendly, Groups, Tourists",,"Credit cards, Debit cards, NFC mobile payments","Good for kids, High chairs, Kids' menu",FALSE,TRUE,purchase_dataset@,FALSE,TRUE,0,,,,,,,,,,,,,,,,,,,,,,,,,,,,,,,,,,,,,,,,,,,https://order.tacotime.com/menu/tacotime-lyman,,,2026-04-11T13:07:43.520075+00:00,,,,,,,,0.0,0.0,50.0,0.1453,,,,-1.0,,,,,0.0,,,,,,,,,,0.0,100.0,0.0,stable,stable,,,,,0,0,0,1,,-100.0,,29.3,19.5,0,67,50.0,94.0,2,7,7,1523,4429,4429,724441,1528676,1528676,781719,2,,,,,,,,,,1349,2,8,1549,4223,735647,1464979,735647,,,,,,,,,,,,,,,,,,,,,,,,,,,,,,,,,,,,,,,,,,,,,,,,,,,,,,,,,,,,,,,,,,,,,,,,,,,,,,,,,,,,,,,,,,,,,,,,,,,,,,,,,,,,,,,,,,,,,,,,,,,,,,,,,,,,,,,,,,,,,,,,,,,,,,,,,,,,,,,,,,,,,,,,,,,,,,,,,,,,,,,,,,,,,,,,,,,,,,,2,42.3,3.96,58,61.5,0.2555,-13.0,,-58,-0.2555,0.0,1.0,0.0,0.0,0.0,2,43.92,-43.92,0.0,2,,,,,,,,,,,,,,,,,,,,,0.0,,0,0.0,0.0,,,,,,,,,,,,,,,,,,,,,,,,,,,,,,,,,,,,,,,,,,,,,,,,,,,,,,,,,,,,,,,,
HHCBQ2GA,Thermopolis Cafe,Food and Drink,Restaurants,Breakfast restaurant,Breakfast restaurant,"109 S 6th St, Thermopolis, WY 82443",109 S 6th St,Thermopolis,Wyoming,,,82443,US,True,43.6457011,-108.2117961,America/Denver,(307) 86*-****,2,CLOSED_PERMANENTLY,FALSE,TRUE,,True,Thermopolis,Wyoming,US,,,,,,,,,,,,0,0,0,,TRUE,FALSE,4.3,0,"{""1"": 8, ""2"": 3, ""3"": 12, ""4"": 49, ""5"": 100}",,,,,Coffee,"Breakfast, Lunch",,,,,,,FALSE,FALSE,purchase_dataset@,FALSE,TRUE,0,,,,,,,,,,,,,,,,,,,,,,,,,,,,,,,,,,,,,,,,,,,,,,2026-04-11T11:11:13.819409+00:00,,,,,,,,0.0,0.0,50.0,,,,,,,,,,,,,,,,,,,,,,,,,,,,,,,,,,,,25.6,19.5,0,33,50.0,88.0,6,13,13,1456,4160,4160,701612,1456261,1456261,757050,6,,,,,,,,,,1349,8,14,1549,4223,735647,1464979,735647,,,,,,,,,,,,,,,,,,,,,,,,,,,,,,,,,,,,,,,,,,,,,,,,,,,,,,,,,,,,,,,,,,,,,,,,,,,,,,,,,,,,,,,,,,,,,,,,,,,,,,,,,,,,,,,,,,,,,,,,,,,,,,,,,,,,,,,,,,,,,,,,,,,,,,,,,,,,,,,,,,,,,,,,,,,,,,,,,,,,,,,,,,,,,,,,,,,,,,,5,56.6,4.53,150,80.4,0.4164,-31.0,,-150,-0.4164,0.0,1.0,0.0,0.0,0.0,5,53.32,-53.32,0.0,5,,,,,,,,,,,,,,,,,,,,,0.0,,0,0.0,0.0,,,,,,,,,,,,,,,,,,,,,,,,,,,,,,,,,,,,,,,,,,,,,,,,,,,,,,,,,,,,,,,,
LS76G5S6,The Burger Barn,Food and Drink,Restaurants,Hamburger restaurant,Hamburger restaurant,"9865 US-191, Pinedale, WY 82941",9865 US-191,Pinedale,Wyoming,,,82941,US,False,42.858647999999995,-109.85137809999999,America/Denver,(201) 33*-****,1,CLOSED_TEMPORARILY,FALSE,TRUE,,False,Pinedale,Wyoming,US,http,http://facebook.com/theburgerbarn,facebook.com/theburgerbarn,facebook.com,com,10608,1997-03-29,2034-03-30,"RegistrarSafe, LLC",,,0,0,0,,TRUE,FALSE,4.4,0,"{""1"": 10, ""2"": 12, ""3"": 13, ""4"": 43, ""5"": 162}","Outdoor seating, Delivery, Onsite services, Takeout, Dine-in",,,,Comfort food,"Lunch, Dinner, Catering, Counter service, Dessert, Seating",Restroom,,"Family-friendly, LGBTQ+ friendly, Transgender safespace",,"Checks, Debit cards, NFC mobile payments","Good for kids, Kids' menu",FALSE,TRUE,purchase_dataset@,TRUE,TRUE,1,,,,,,,,,,,,http://www.facebook.com/theburgerbarn,theburgerbarn,,,,,,,,,,,,,,,,,,,,,,,,,,,,,,https://places.singleplatform.com/burger-barn-33/menu,,,2026-04-11T10:43:31.949359+00:00,,,79.8,2678.3,1931.6,25.2101,0.59,0.0,0.0,50.0,0.7158,,,,-0.2017,0.0033,0.1283,,,39.9,,,,,,,,,,0.0,100.0,0.0,stable,stable,,,,,0,0,0,1,,-100.0,,29.8,19.5,8,67,50.0,88.0,64461,120789,120789,1476,4242,4242,708995,1478399,1478399,764994,64461,745853,2,744380,748657,8,750435,,,,1349,10918,41212,1549,4223,735647,1464979,735647,,,,,,0.0008,0.0,0.0,0.0,0.0,0.0207,0.0,-0.0035,0.0,0.0035,,1,7,745853,744440,744380,0.0019,0.0,0.0,0.0046,0.0033,26.2,0.0,0,50.0,0.0,3.6,,0,0.0,0.0,748657,727207,750435,0.0131,0.0404,0.0109,0.0884,0.1283,51.9,3.54,77,72.7,0.4404,-22.1,,-77,-22.7,-0.4404,,,,,Emerging,,,,,Emerging,,,,,,,,,,,,2,8,,947,947,concentrated,0,0.32,100.0,0.0,0.0,0.0,1609,1220,moderate,0.0,0.09,14.3,57.1,28.6,0.0,,,,,,,,,,0.0,-0.0031,0.0,0.0031,8,9,4306,1,1547,0.4014,0.6385,0.7839,0.3232,0.3207,48.7,3.1,67,69.9,0.3854,-18.9,,-67,-19.9,-0.3854,moderate,0.0,1.43,25.0,50.0,25.0,0.0,0.5873,0.59,19.43,0.0206,0.2927,-0.0206,-0.2927,100,101,1532,1,318,0.1226,0.9118,0.807,0.1718,0.2457,63.7,4.23,307,80.2,0.4347,-33.9,,-307,-30.2,-0.4347,competitive,0.0,0.0004,1.08,1.1,0.5647,0.08,0.3009,-0.08,-0.3009,793989,61.4,3.79,385,76.0,0.4601,-31.6,,-385,-0.4601,0.0884,0.9063,0.0,0.048,0.0391,723556,0.3073,-26.0,1,719601,25.1,59.3,4.4,11.2,793990,,,,,,,,,,,,,,,,,,,,,39.9,251,357,0.2678,2678.3,1.73,5769,2,0.0533,532.77,0,5000.0,0.0,1250.0,,,0.0,1111.11,0.0,99.01,0.0,,0,0.0,0.0,,,,,,0.0,745853,0.002,0.0,745853,0.002,0.02,748657,0.013,0.02,748657,0.013,0.0,0,0.0,0.0,0,0.0,0.59,4306,0.401,0.59,4306,0.401,0.56,1532,0.123,0.56,1532,0.123,,,,,,,,,,,,,,,,,,,,,,,,,,,,,
T438S6VG,The Bear Pit BBQ: Food Trailer,Food and Drink,Restaurants,Restaurant,Restaurant,"82717 US-89, Afton, WY 83110",82717 US-89,Afton,Wyoming,,,83110,US,True,42.6919393,-110.93175989999999,America/Denver,(307) 22*-****,0,CLOSED_PERMANENTLY,FALSE,FALSE,,True,Afton,Wyoming,US,https,https://m.facebook.com/thebearpitbbq,m.facebook.com/thebearpitbbq,m.facebook.com,com,10608,1997-03-29,2034-03-30,"RegistrarSafe, LLC",,,0,0,0,,TRUE,FALSE,5,0,"{""1"": 0, ""2"": 0, ""3"": 0, ""4"": 0, ""5"": 11}",,,,,,,,,,,,Good for kids,FALSE,TRUE,purchase_dataset@,FALSE,TRUE,0,,,,,,,,,,,,,,,,,,,,,,,,,,,,,,,,,,,,,,,,,,,,,,2026-04-11T09:13:25.067932+00:00,0.0,,3.0,7237.57,1487.5,31.9149,1.03,0.0,0.0,50.0,,,,,,,,,,,,,,,,,,,,,,,,,,,,,,,,,,,,27.2,19.5,0,50,50.0,86.0,13,38,38,1515,4394,4394,722100,1520776,1520776,779172,13,,,,,,,,,,1349,15,38,1549,4223,735647,1464979,735647,,,,,,,,,,,,,,,,,,,,,,,,,,,,,,,,,,,,,,,,,,,,,,,,,,,,,,,,,,,,,,,,,,,,,,,,,,,,,,,,,,,,,,,,,,,,,,,,,,,,,,,,,,,,,,,,,,,,,,,,,,,,,,,,,,,,,,,,,,,,,,,,,,,,,,,,,,,,,,,,,,,,,,,,,,,,,,,,,,,,,,,,,,,,,,,,,,,,,,,12,52.2,4.33,157,71.1,0.357,-25.0,,-157,-0.357,0.1818,0.7273,0.0,0.0,0.0,10,49.69,-49.69,0.0,12,,,,,,,,,,,,,,,,,,,,,0.0,,0,0.0,0.0,,,,,,,,,,,,,,,,,,,,,,,,,,,,,,,,,,,,,,,,,,,,,,,,,,,,,,,,,,,,,,,,
